Start,End,Text,Character,SentenceIndex
4473.469,4475.599,"As for the pulmonary trunk, it took longer than expected",2.0,1303
4475.679,4477.099,because we wanted to save the valve.,2.0,1304
4477.181,4481.061,"But that went well too, so it's closed nicely now.",2.0,1305
4481.935,4484.855,"His surgery went well, so please don't worry.",2.0,1306
4484.938,4487.518,We'll move him to the ICU in about half an hour.,2.0,1307
4487.608,4488.568,I'll see you then.,2.0,1308
4491.57,4493.91,"His surgery went well, so please don't worry.",2.0,1309
4494.656,4497.196,"-My gosh. -Thank you, Doctor!",,1310
4510.38,4511.26,Hello?,,1311
4511.507,4512.547,"Yes, hello.",3.0,1312
4512.633,4515.513,"Well, my son had lunch at your restaurant earlier today",3.0,1313
4515.594,4517.604,and had an allergic reaction.,3.0,1314
4517.679,4519.519,He's allergic to peanuts. He probably ate some.,3.0,1315
4519.598,4521.728,"Gosh, I'm sorry. Is he okay?",,1316
4521.808,4523.138,"Yes, he's okay now.",3.0,1317
4523.227,4525.187,But I'd like to find out exactly what he ate.,3.0,1318
4525.27,4526.15,He's five years old.,3.0,1319
4526.23,4527.94,I think he ate there with his mom.,3.0,1320
4528.023,4529.073,I remember him.,,1321
4529.149,4531.149,I took their order.,,1322
4531.485,4532.565,"Just a moment, please.",,1323
4532.903,4537.993,"Oh, right. Sir, the salad you took to go to have for dinner.",3.0,1324
4538.075,4540.825,It probably had peanut dressing.,3.0,1325
4541.245,4542.615,Did I get...,,1326
4544.998,4546.328,"Right, I did.",3.0,1327
4546.416,4548.996,"Yes, you did, sir.",,1328
4549.503,4553.423,I remember you because you and your wife looked so lovely together.,,1329
4553.507,4555.217,Your kid was so cute too.,,1330
4556.593,4561.313,I'm pretty sure I asked you to let me know if you had any food allergies.,,1331
4561.932,4564.522,I apologize. I guess I didn't communicate that properly.,,1332
4577.99,4579.58,-Hello? -Professor.,3.0,1333
4579.658,4581.658,"This is Ham Deok-ju, a transplant coordinator.",,1334
4581.743,4584.293,"The chairman is coming from the airport due to a conference,",,1335
4584.371,4587.291,so the committee meeting will be held after 10 p.m.,,1336
4587.374,4588.214,Okay.,3.0,1337
4588.292,4591.592,We want to arrange a time for you to see him as soon as the meeting is over.,,1338
4591.67,4594.34,We've already let the other hospital know.,,1339
4594.423,4596.473,I'll call you when we're ready.,,1340
4596.55,4597.55,Okay.,3.0,1341
4602.264,4603.274,What's with him?,,1342
4605.851,4608.101,"It's taking longer than we expected,",,1343
4608.478,4610.018,but it'll be over soon.,,1344
4611.273,4613.573,You should wait in the waiting area.,,1345
4614.318,4615.278,Let's go.,,1346
4616.111,4620.411,FAMILY WAITING ROOM,,1347
4620.741,4622.161,Thank you.,,1348
4625.203,4627.663,So what's happening next?,,1349
4627.748,4629.168,"If you'd like,",,1350
4629.499,4632.839,we'll arrange a time for you to see him before the surgery begins.,,1351
4633.503,4635.423,"Once he's in the OR,",,1352
4635.505,4638.425,the doctors will check the condition of his organs,,1353
4638.508,4640.468,and conduct biopsies.,,1354
4640.552,4642.602,"If everything looks good,",,1355
4642.679,4645.679,they'll start preparing him right away for organ donation.,,1356
4646.808,4649.438,"This process is usually carried out by fellows,",,1357
4649.519,4653.519,but Professor Lee Ik-jun will oversee the entire process.,,1358
4654.191,4657.611,He's even concerned about the surgical wound.,,1359
4660.405,4661.315,Hello?,,1360
4661.823,4663.453,Okay.,,1361
4665.452,4667.952,The committee meeting just ended.,,1362
4668.997,4671.247,"I'll get ready, then.",,1363
4681.385,4683.385,Where are you? You said you'd be here right away.,,1364
4683.47,4684.47,I'm almost there.,,1365
4684.554,4685.764,Okay.,,1366
4686.515,4688.135,Is he having a bad day or something?,,1367
4689.518,4691.348,Are you from Kangwoon University Medical Center?,,1368
4691.436,4692.396,Yes.,,1369
4692.479,4694.609,"I had to speak with his family, so we're running behind.",,1370
4694.69,4696.15,I'm sorry. Do we have enough time?,,1371
4696.233,4698.493,The donor's vitals are good.,,1372
4699.111,4700.571,"Yes, we're early.",,1373
4701.154,4702.534,"It's not that urgent, so it's fine.",,1374
4709.913,4711.043,We'll get started.,3.0,1375
4711.123,4712.173,-Okay. -All right.,,1376
4724.678,4726.178,Is the patient stable?,,1377
4726.471,4727.851,"Yes, everything looks good.",3.0,1378
4740.485,4743.695,"Professor Lee, everything's ready.",,1379
4748.785,4751.705,"-Kangwoon University Medical Center? -Yes, Professor.",3.0,1380
4754.082,4756.962,"Well, can I ask you a favor?",3.0,1381
4757.878,4758.708,Sure.,,1382
4758.795,4762.045,Could we postpone the heart removal by just ten minutes?,3.0,1383
4764.801,4767.851,Call the hospital and find out if it's okay.,3.0,1384
4767.929,4770.219,"If it's urgent, we can get started right away.",3.0,1385
4771.85,4774.81,Ten minutes should be okay. We got here early.,,1386
4774.895,4778.315,"Okay. It's 11:50 p.m. now,",3.0,1387
4778.398,4781.108,-so we'll start in ten minutes. -Okay.,3.0,1388
4781.193,4783.403,We'll begin at midnight with a silent prayer.,3.0,1389
4783.487,4785.157,-Got it. -Wait.,,1390
4785.238,4788.408,Can't we just do it now?,,1391
4788.492,4790.952,We've pulled two all-nighters in a row.,,1392
4791.036,4793.996,"Today is Children's Day, you know.",,1393
4794.623,4795.463,Pardon?,,1394
4798.668,4800.548,It's because today is Children's Day.,,1395
4806.384,4809.934,He has a five-year-old son named Won-jun.,,1396
4810.722,4813.312,"Today's Children's Day, so he was supposed to have...",,1397
4816.77,4818.48,jajangmyeon with his dad.,,1398
4819.564,4822.614,But Won-jun...,,1399
4823.777,4825.897,"He'll never get to do that, for the rest of his life.",,1400
4852.764,4853.814,Let's wait.,3.0,1401
4854.933,4856.103,Just ten minutes.,3.0,1402
4856.601,4858.811,"We'll begin in ten minutes, okay?",3.0,1403
4859.521,4861.231,We can't have his son cry,3.0,1404
4861.314,4864.734,on every Children's Day thinking about his late father.,3.0,1405
4865.318,4867.448,"Okay, no problem.",,1406
4867.737,4868.857,"Sure, Professor.",,1407
4868.947,4870.817,-Thank you. -No problem.,,1408
4893.889,4898.889,Your late husband decided to donate his organs to help others.,,1409
4898.977,4900.727,"Thankfully, his organs are in good condition,",,1410
4900.812,4904.982,"so he'll be donating his heart, lungs, kidneys, and liver.",,1411
4906.61,4910.78,"The surgery began just now, at 12:05 a.m. on May 6,",,1412
4912.532,4916.162,which means he has expired.,,1413
4917.787,4918.957,Thank you.,,1414
4951.112,4953.412,"I have to work the night shift anyway, so I came to work.",3.0,1415
4954.199,4955.369,"Yes, Mom.",3.0,1416
4955.951,4957.541,You're feeling okay? Any health issues?,3.0,1417
4958.328,4959.448,What about Dad?,3.0,1418
4961.665,4963.115,All right.,3.0,1419
4963.5,4965.79,"I'll buy her food, coffee, and everything. Don't worry.",3.0,1420
4966.044,4969.464,But it's not like she's here to see me. That girl...,3.0,1421
4971.132,4973.052,"Okay, bye.",3.0,1422
4978.848,4980.098,It's raining a lot.,5.0,1423
4981.935,4983.645,We can't go camping in this weather.,,1424
4985.146,4986.146,I won't force you guys.,5.0,1425
4986.231,4988.731,You don't have to come. Do whatever you want.,5.0,1426
4992.737,4994.197,You'll go camping in this weather?,5.0,1427
4997.033,4998.873,I love going camping on a rainy day.,5.0,1428
4998.952,5000.662,"Anyway, I'm totally fine with going alone,",5.0,1429
5000.745,5001.825,so do whatever you want.,5.0,1430
5003.79,5006.42,NEUROSURGERY TEAM CHAT ROOM,,1431
5006.501,5008.711,But you'll be bored if you go alone.,,1432
5012.048,5016.548,I'll go somewhere really far,,1433
5016.636,5020.886,I'll travel until the sun goes down,,1434
5021.933,5024.733,I'll start afresh,,1435
5025.311,5028.361,For myself,,1436
5045.79,5047.08,"Professor, you beat me.",,1437
5047.167,5049.127,Is Dr. Do in an emergency surgery?,2.0,1438
5049.21,5051.13,"Yes. It looked like a tension pneumothorax,",,1439
5051.212,5052.462,so I called you right away.,,1440
5052.547,5053.667,Good. I was in the area.,2.0,1441
5053.757,5055.877,But why was a soldier transferred to a regular hospital?,2.0,1442
5055.967,5058.427,They had an accident across the street and has a broken rib.,,1443
5058.511,5059.761,No other external injuries.,,1444
5059.846,5061.846,-Where's the patient? -Here.,2.0,1445
5097.675,5099.425,LEE IK-SUN,,1446
5107.811,5108.691,YEONINSAN CAMPGROUND,,1447
5117.695,5120.405,I said it's fine. You don't have to come.,5.0,1448
5122.826,5123.826,Where are you?,5.0,1449
5124.661,5127.581,Here? B-104.,5.0,1450
5128.289,5130.289,Where's 104?,,1451
5130.375,5131.415,I'm here!,5.0,1452
5131.751,5133.041,Over here.,5.0,1453
5142.345,5144.715,What's up? What are you doing here?,5.0,1454
5146.141,5148.231,What do you mean? I promised to join you.,,1455
5148.309,5149.809,I never said I couldn't come.,,1456
5150.603,5151.943,"Anyway, sit down.",5.0,1457
5152.313,5153.903,-Have some coffee. -Okay.,5.0,1458
5163.199,5164.579,You're wearing those again.,,1459
5164.659,5165.659,What?,5.0,1460
5167.12,5168.66,The shoes I gave you.,,1461
5170.206,5171.206,What?,,1462
5174.169,5177.459,"I got you those shoes, Professor.",,1463
