Start,End,Text,Character,SentenceIndex
2955.702,2956.952,Won-jun!,3.0,865
2958.121,2960.291,"-Hello, Dr. Lee. -Yes, hello.",,866
2960.374,2962.174,Give me that. I'll do it for you.,3.0,867
2962.292,2963.792,My gosh.,,868
2963.919,2967.509,"Mr. Yuk, you don't even look like a patient without your IV drip.",3.0,869
2967.589,2968.629,You're handsome.,3.0,870
2968.715,2969.755,"Gosh, I'm flattered.",,871
2969.841,2971.801,You remembered his name.,,872
2971.885,2973.385,You must have a lot of patients.,,873
2973.47,2975.56,My wife's surname is also Yuk.,3.0,874
2975.639,2977.979,"Other than her, you're the only one I know with that surname.",3.0,875
2978.058,2981.938,"Actually, there's my father-in-law, brother-in-law, sister-in-law, and niece.",3.0,876
2982.02,2983.77,"Gosh, there are so many.",3.0,877
2984.398,2985.648,"You're going home today, right?",3.0,878
2985.732,2989.242,"Yes. Tomorrow is Children's Day, so I'm happy I can be home for that.",,879
2989.82,2990.78,"Yes, you're right.",3.0,880
2990.862,2992.282,I can't go anywhere far.,3.0,881
2992.364,2995.124,We're just going to eat at a Chinese restaurant near our place.,3.0,882
2995.2,2996.7,Won-jun loves jajangmyeon.,,883
2996.785,2999.535,My kid loves jajangmyeon too. All kids do.,3.0,884
3000.08,3002.12,"You had a simple laparoscopic cholecystectomy,",3.0,885
3002.207,3004.327,so don't worry about post-surgical complications.,3.0,886
3004.418,3006.038,Don't overexert yourself,3.0,887
3006.128,3008.088,but try to walk as much as you can.,3.0,888
3008.171,3009.971,"Exercise will help you, okay?",3.0,889
3010.465,3012.715,All right. Here you go.,3.0,890
3012.801,3015.181,"Wow, who are you?",,891
3015.262,3016.352,Won-jun.,,892
3016.43,3018.43,"You silly goose, what do you think?",3.0,893
3018.515,3020.975,I'm the one who got rid of the ouchy from your dad's tummy.,3.0,894
3021.56,3023.65,Goodbye. I'll see you at your next appointment.,3.0,895
3023.729,3025.519,-Thank you. -Thank you.,,896
3025.605,3026.855,Say goodbye properly.,,897
3027.357,3029.227,"-Thank you, Dr. Lee! -My pleasure!",,898
3029.317,3031.737,"Oh, my. Look at this.",,899
3031.82,3033.2,-Hello. -Hello.,,900
3036.658,3037.618,Hello.,,901
3039.327,3040.617,Did Song-hwa scold you again?,3.0,902
3040.704,3042.374,-Yes. -No.,,903
3042.873,3044.123,I guess it was you then.,3.0,904
3044.207,3046.417,It was Chi-hong this time.,,905
3046.501,3047.631,But he said no.,3.0,906
3048.17,3050.59,He's a tough cookie because he has a military background.,,907
3051.214,3054.434,It happened because I couldn't answer her questions.,,908
3054.551,3056.051,Even I thought I sounded dumb.,,909
3056.136,3058.756,"You graduated from the Korea Military Academy, right?",3.0,910
3058.847,3061.427,-Yes. -I know someone from...,3.0,911
3061.516,3062.766,Hello?,3.0,912
3063.351,3064.901,"Yes, where are you?",3.0,913
3065.312,3067.562,"Okay, I'll head over there now. All right.",3.0,914
3070.942,3071.942,"Yes, Professor.",,915
3072.611,3073.611,Right.,,916
3074.279,3075.609,"Yes, I got it.",,917
3076.49,3078.37,You know the emergency patient from the traffic accident yesterday?,,918
3078.45,3079.74,-Yes. -We haven't operated,,919
3079.826,3082.156,because of unstable vitals and severe bleeding.,,920
3082.245,3083.455,But it seems Professor Chae,,921
3083.538,3085.618,-will perform the surgery tonight. -I see.,,922
3085.707,3087.917,"-There will be a meeting later. -Okay, great.",,923
3088.21,3090.67,"-""Great""? Really? -Yes.",,924
3090.754,3092.464,She totally put you on the spot earlier.,,925
3092.631,3095.051,She was just asking questions.,,926
3095.509,3097.259,I wanted to work on that case anyway.,,927
3097.344,3100.764,I was hoping to be assigned in assisting Professor Chae for the case.,,928
3100.889,3102.219,This is perfect.,,929
3102.557,3104.517,-Dr. Ahn. -Yes.,,930
3104.601,3106.851,Why don't you get a cranial CT scan?,,931
3108.73,3110.48,"Sure, if there's an employee discount.",,932
3129.709,3131.459,Sounds good. We'll do that.,5.0,933
3133.713,3135.013,You should take a nap,5.0,934
3135.09,3136.38,and I'll see you guys tonight.,5.0,935
3136.466,3137.466,Okay.,,936
3140.595,3143.715,She was going to do that with the surgery anyway.,,937
3143.807,3145.097,You know that's not what matters.,,938
3145.183,3147.233,What matters to her is whether we knew it or not.,,939
3153.441,3154.401,There are roses.,,940
3155.11,3156.61,Is it already the season for roses?,,941
3158.029,3160.159,"Dr. Yong, you're very observant.",,942
3160.24,3161.7,My family has a flower shop.,,943
3161.783,3163.663,Everyone knows what roses look like.,,944
3163.743,3164.913,"Not really. These days,",5.0,945
3164.995,3167.745,many people don't know the names of plants and flowers.,5.0,946
3173.962,3175.632,Are they fake flowers?,,947
3183.638,3186.018,That's just wrong.,,948
3189.978,3193.148,I'm just realizing that it's been a long time since I saw real flowers.,,949
3193.815,3196.355,"Professor Chae, are you going camping again this weekend?",5.0,950
3196.443,3197.493,"Yes, why do you ask?",,951
3197.569,3198.949,Can we join?,,952
3199.07,3201.41,"You can come, right? You're not working this weekend.",,953
3202.073,3203.453,Can we join?,,954
3203.533,3206.543,"Yes, you can. But do you guys really want to come?",5.0,955
3206.62,3207.7,Yes.,,956
3207.954,3210.424,"You keep us on our toes,",,957
3210.999,3212.419,but you don't make us uncomfortable.,,958
3212.667,3215.547,"Gosh, Seok-min. My goodness.",,959
3216.338,3217.588,I just can't hate you.,,960
3217.672,3219.092,"You annoy me here and there,",5.0,961
3219.174,3220.684,but you don't make me uncomfortable.,5.0,962
3222.385,3224.845,"Okay, let's do it. There, you can see real roses",5.0,963
3224.93,3226.56,as well as butterflies.,5.0,964
3226.64,3227.47,I'm off.,5.0,965
3234.064,3235.074,Did you order?,3.0,966
3235.44,3236.78,The coffee here is very good.,3.0,967
3237.275,3238.275,Do you want some cake?,3.0,968
3239.486,3241.276,Can we go somewhere quiet?,,969
3242.447,3244.987,-What? -I have to talk to you about something.,,970
3249.246,3251.406,YULJE MEDICAL CENTER,,971
3255.46,3256.54,Ho-jun.,,972
3257.087,3258.877,Go get changed.,,973
3258.964,3261.884,I brought a T-shirt and a pair of pants for you.,,974
3261.967,3263.587,The visiting hours will begin shortly.,,975
3263.677,3265.347,I'll get changed after I see Dad.,,976
3265.428,3268.808,"Gosh, you still have 20 to 30 minutes.",,977
3269.891,3272.731,"Hey, I see some chairs over there. Let's go sit down.",,978
3272.811,3274.021,Okay.,,979
3275.23,3276.65,She must be out of her mind.,,980
3278.483,3282.073,I can't believe this. Did she cancel her honeymoon?,,981
3282.279,3284.359,Eun-bin! We're here.,,982
3289.202,3290.752,"Hey, don't be like that.",,983
3290.954,3292.294,Everything went well.,,984
3296.418,3298.208,Jin-hui is a good photographer.,,985
3298.295,3299.955,"No, it's my camera.",,986
3300.046,3302.166,"Downloading all the photos would be a nuisance,",,987
3302.257,3304.047,so I told her to use my phone to take photos.,,988
3304.676,3307.136,"Oh, your uncle was there too.",,989
3307.804,3310.354,He said he wouldn't be able to make it.,,990
3310.432,3312.892,"Oh, who's this?",,991
3314.019,3316.809,Isn't he the doctor who performed your dad's surgery?,,992
3316.896,3318.766,"Eun-bin, Dad's doctor came to your wedding?",,993
3318.857,3319.977,Yes.,,994
3320.066,3320.896,When?,,995
3321.651,3324.491,He was the first one to stop by the bride's room.,,996
3324.571,3326.741,What's with that face though?,,997
3326.823,3329.453,He didn't even take a picture. He just ate and left.,,998
3329.534,3330.874,Come on. Be grateful that he came.,,999
3330.952,3333.292,He asked me about the main course. I told him it's galbitang.,,1000
3333.371,3336.331,Then he got excited and rushed to the diner.,,1001
3336.416,3338.336,He obviously came to my wedding to have dinner.,,1002
3338.418,3340.588,Come on. Galbitang is nothing.,,1003
3340.67,3343.72,I'd love to take him out for a steak dinner.,,1004
3344.215,3346.335,He'd say no to that anyway.,,1005
3346.426,3348.046,Doctors can't say yes to things like that.,,1006
3348.136,3350.176,"I didn't think he'd be like this,",,1007
3350.347,3351.847,but he's actually very charming.,,1008
3351.931,3354.731,The ICU is open now. Come on in.,,1009
3354.809,3356.849,"Oh, okay. Thank you.",,1010
3356.936,3358.186,Thank you.,,1011
3361.274,3363.194,"Hey, don't cry.",,1012
3363.777,3365.487,Are you going to cry in front of Dad?,,1013
3368.239,3369.659,"Seriously, don't cry.",,1014
3369.741,3371.911,Why are you crying? His surgery went well.,,1015
3372.494,3374.084,Dad will be so sad to see you cry.,,1016
3376.748,3377.668,Stop crying.,,1017
3378.124,3380.544,"You will break Dad's heart. You know that, right?",,1018
3380.627,3381.837,Right.,,1019
3385.215,3386.045,Smile.,,1020
3390.428,3391.508,Give me a bigger smile.,,1021
3397.519,3398.519,Aren't you leaving?,5.0,1022
3399.02,3401.86,"Hey. I have surgery tomorrow as well as patient appointments,",2.0,1023
3401.94,3404.07,-so I have a lot to do. -Then reschedule the surgery.,2.0,1024
3404.15,3406.03,I can't do that.,2.0,1025
3406.111,3407.571,How many appointments?,5.0,1026
3407.654,3408.664,Twenty.,2.0,1027
3408.738,3410.278,I have to go through their charts.,2.0,1028
3410.949,3412.199,Why are you still here?,2.0,1029
3412.492,3414.082,"Everyone did a good job with the surgery,",5.0,1030
3414.16,3415.58,so I want to stop by the office.,5.0,1031
3415.662,3418.422,-Go check in on Ik-jun. -Why?,2.0,1032
3418.498,3420.878,"I think something's up, but he won't tell me.",2.0,1033
3420.959,3422.999,"-Really? -I think it's a family matter,",2.0,1034
3423.086,3424.956,so I didn't want to pry.,2.0,1035
3425.547,3427.417,But that doesn't sound like him.,5.0,1036
3427.507,3430.007,"Well, I'm sure he'll sort it out.",5.0,1037
3430.093,3431.013,Bye.,5.0,1038
3439.561,3441.231,What did you just say?,3.0,1039
3441.896,3443.566,I said I want a divorce.,,1040
3445.4,3448.19,I wouldn't call this a normal marriage.,,1041
3448.695,3450.355,Let's just go back to being friends.,,1042
3452.699,3454.739,We're like this because this was what you wanted.,3.0,1043
3456.161,3457.951,"When you got transferred,",3.0,1044
3458.538,3461.038,I told you I'd follow you to Germany,3.0,1045
3461.124,3461.964,and you refused.,3.0,1046
3462.041,3463.541,You wanted me to keep working.,3.0,1047
3463.626,3465.746,"Also, you wanted to raise U-ju in Korea.",3.0,1048
3465.837,3468.337,That's why we're living like this. So were we...,3.0,1049
3471.009,3472.389,Were we separated?,3.0,1050
3472.469,3473.889,"No, we weren't.",3.0,1051
3475.138,3476.968,I like that you have a career.,3.0,1052
3478.349,3481.099,And I can totally look after U-ju by myself.,3.0,1053
3481.686,3485.566,"I know that we've been living apart for quite a while,",3.0,1054
3485.648,3487.648,but we made that decision together.,3.0,1055
3487.734,3488.944,Why are you saying...,3.0,1056
3490.361,3491.321,What's going on?,3.0,1057
3493.239,3494.819,What's the real reason?,3.0,1058
3494.908,3496.988,There's no such thing.,,1059
3497.994,3502.174,I just felt that it was meaningless,,1060
3502.29,3504.38,to maintain this kind of marriage.,,1061
3507.712,3508.922,Do you mistrust me?,,1062
3509.547,3510.377,No.,3.0,1063
3512.05,3514.18,"I'm going to have lunch with U-ju tomorrow,",,1064
3514.26,3515.64,just the two of us.,,1065
3515.72,3517.18,"It's a special day, you know.",,1066
3518.014,3519.354,You should work.,,1067
3519.432,3521.272,I'll stay with him tomorrow.,,1068
3522.852,3526.022,And about what I said...,,1069
3527.273,3530.323,I hope you take it seriously.,,1070
3553.716,3555.796,"Dr. Ahn, do you want to go for coffee?",5.0,1071
3556.678,3557.678,Sure.,,1072
3560.139,3562.769,How many questions did I ask you today?,5.0,1073
3566.271,3567.311,I'm not sure.,,1074
3568.106,3570.186,There were many. So many.,5.0,1075
3570.942,3571.782,I'm sorry.,5.0,1076
3571.859,3573.399,"No, it's okay.",,1077
3573.486,3577.406,"Chi-hong, do you know how many operations I perform on a weekly basis?",5.0,1078
3579.242,3580.792,"Jeez, I'm asking you a question again.",5.0,1079
3581.494,3583.294,"I have a problem, don't I?",5.0,1080
3583.496,3585.036,I'm really sorry.,5.0,1081
3585.123,3587.673,"I think you do more than five a week, on average.",,1082
3588.251,3589.711,"That means, in a year...",5.0,1083
3590.378,3593.378,"I probably do about 250, roughly speaking.",5.0,1084
3593.715,3594.835,Right.,,1085
3595.55,3597.05,I want you to be on your toes.,5.0,1086
3600.054,3602.274,When you're performing surgery or treating patients.,5.0,1087
3602.849,3605.269,Both you and Seok-min,5.0,1088
3605.56,3608.19,should stay alert and focused at all times. That's why I do it.,5.0,1089
3610.231,3611.271,Yes.,,1090
3612.483,3614.323,"You see, this job is hard.",5.0,1091
3614.402,3615.652,But you get used to it quickly.,5.0,1092
3616.738,3621.698,"The thing is though, we should never get too comfortable doing this.",5.0,1093
3622.076,3623.156,That's why.,5.0,1094
3625.288,3626.118,Right.,,1095
3626.998,3629.878,"It's not because I don't like you, so don't get me wrong.",5.0,1096
3630.793,3632.753,And you'd better not give up halfway through.,5.0,1097
3633.338,3634.418,Okay.,,1098
3634.505,3636.545,Just trust me and follow my lead.,5.0,1099
3637.592,3640.682,"-Do you understand, Captain Ahn? -Yes, ma'am.",5.0,1100
3652.44,3654.32,"-Hey. -Professor, Chan-hyeong is doing great.",,1101
3654.4,3655.9,I checked everything just now.,,1102
3655.985,3658.905,Really? There's no need for me to check? All his ABGA and PaO2 results look good?,2.0,1103
3658.988,3661.028,"Yes. Everything looks good,",,1104
3661.115,3663.575,so just go home already.,,1105
3663.66,3664.58,All right.,,1106
3673.044,3675.764,"Dr. Do walked you through the surgery procedure, right?",2.0,1107
3675.838,3678.378,"Chan-hyeong's condition has improved, so we'll perform surgery...",2.0,1108
3680.343,3681.223,"Oh, my.",,1109
3682.261,3686.221,"Doctor, please take good care of Chan-hyeong.",,1110
3687.35,3690.44,"My gosh, you've been staying so strong until now.",,1111
3690.52,3693.27,Please save Chan-hyeong.,,1112
3694.44,3698.32,I wish it was me instead of him.,,1113
3703.991,3705.741,Don't cry.,2.0,1114
3706.703,3708.963,You've been holding out so well.,2.0,1115
3710.373,3712.543,I've been barely keeping it together.,,1116
3715.837,3720.757,Both my mom and my mother-in-law think that we're still kids.,,1117
3722.009,3724.679,Everyone says that we're immature.,,1118
3725.263,3728.433,So I've been acting all tough on purpose.,,1119
3729.016,3731.186,"I wanted to cry, but I was afraid",,1120
3731.644,3734.694,that they'd say we're too young to deal with this.,,1121
3734.856,3736.976,They would tell me to go home if I burst into tears.,,1122
3737.066,3739.816,What if they wouldn't even let me see Chan-hyeong?,,1123
3739.902,3743.162,That's why I've been forcing myself to act all tough.,,1124
3744.073,3747.833,But I can't do it anymore.,,1125
3749.036,3753.456,"Doctor, Chan-hyeong will be okay, right?",,1126
3754.208,3755.838,We've performed this surgery many times.,2.0,1127
3755.918,3757.588,We'll make sure he'll be okay.,2.0,1128
3758.212,3761.222,"Then, it will go well, right?",,1129
3765.553,3768.223,"Yes, we'll do our best.",2.0,1130
3769.223,3770.933,Thank you.,,1131
3774.854,3778.274,"By the way, why did you go home in the morning?",2.0,1132
3779.901,3783.151,"Oh, Hui-dong's Mom...",,1133
3784.197,3786.737,"-is a shaman. -Oh, I see.",,1134
3787.2,3791.12,She said putting a crock lid upside down and filling it with water,,1135
3791.204,3793.664,could help Chan-hyeong recover soon.,,1136
3795.541,3799.131,I'm sorry. I heard that doctors don't like such superstitions.,,1137
3799.212,3800.882,"Gosh, don't be sorry. It's okay.",2.0,1138
3800.963,3805.263,"If it helps you worry less, you should do it. By all means.",2.0,1139
3807.178,3808.098,Then...,,1140
3814.31,3815.27,Just this.,,1141
3819.941,3821.361,I'm sorry.,,1142
3823.986,3824.986,Don't be.,2.0,1143
3833.913,3835.833,Uncles and Aunts.,3.0,1144
3836.332,3838.422,Chan-hyeong is here.,3.0,1145
3853.683,3855.313,His CRP levels have gone up a little.,2.0,1146
3855.476,3857.186,"Yes, but his CBC level",,1147
3857.27,3859.11,and chest X-ray from this morning look good.,,1148
3859.188,3860.398,All right.,2.0,1149
3863.442,3864.692,Wakanda.,2.0,1150
3866.612,3868.242,You don't know what it is? Black Panther.,2.0,1151
3872.41,3874.62,"Don't say ""Forever."" Just stay still like that.",2.0,1152
3877.29,3878.54,LEE CHAN-HYEONG,,1153
3880.293,3881.543,"Pump on, please.",2.0,1154
3881.752,3884.012,Turning the pump on.,,1155
3889.927,3892.927,"ANESTHESIA DURATION, CURRENT TIME, SURGERY DURATION",,1156
3921.834,3923.254,Is the color of the drainage okay?,3.0,1157
3923.878,3924.918,What about the AC?,3.0,1158
3926.422,3929.972,Okay. Call me when you have the per-hour urine output.,3.0,1159
3930.051,3930.971,All right.,,1160
3931.427,3934.427,"Professor, why didn't you answer your phone?",,1161
3935.014,3937.314,-I was on the phone. -My gosh.,,1162
3937.767,3941.897,They said they couldn't get a hold of you. That's why I'm here. The thing is...,,1163
3942.688,3944.068,It's about Mr. Yuk Hui-gwan.,,1164
3944.148,3945.608,What about him?,,1165
3945.691,3947.191,He was discharged yesterday.,,1166
3947.276,3949.696,They were going through the records,,1167
3949.779,3953.739,and found out that he is the brain-dead organ donor.,,1168
3954.45,3955.87,He came in as a TA victim.,,1169
3955.952,3958.752,"His GCS score was five, which indicated a high probability of brain death.",,1170
3959.33,3960.96,"His family has consented to organ donation,",,1171
3961.04,3963.08,so they've already done an EEG.,,1172
3963.167,3965.537,The committee will meet soon to confirm the diagnosis.,,1173
3965.628,3969.008,"Initially, I was just notified that it was a traffic accident victim.",,1174
3970.508,3972.718,They wanted us to let you know as soon as possible,,1175
3972.802,3974.762,because he's your patient.,,1176
3975.888,3978.018,"The organ is going to another patient at our hospital,",,1177
3978.099,3980.269,so we'll have to take care of the procurement as well.,,1178
3982.019,3985.269,"Gosh, I feel bad.",,1179
3989.944,3992.364,"His tricuspid valve is very small, so it's hard to see.",2.0,1180
3993.114,3995.664,"No, not that way. Pull it toward the patient's head.",2.0,1181
3996.158,3997.448,Yes.,,1182
3998.911,4001.541,"Pull harder, or we'll have to make a bigger incision.",2.0,1183
4001.622,4003.122,"Okay, I'm sorry.",,1184
4005.793,4007.593,"You see that monitor, right?",,1185
4007.67,4010.59,"The line is flat now, which means the heart rate is zero.",,1186
4010.673,4011.593,That means he's dead.,,1187
4012.258,4013.338,No.,,1188
4013.426,4016.596,It just means that Chan-hyeong's current heart rate is zero.,,1189
4016.679,4019.639,His heart isn't beating at the moment.,,1190
4019.724,4022.104,They can't operate on him while the heart is beating.,,1191
4022.184,4024.524,That's why the cardioplegia solution is administered,,1192
4024.603,4026.813,every 30 minutes to induce cardiac stasis when performing,,1193
4026.897,4028.147,any cardiac surgery procedures.,,1194
4028.232,4030.572,"And during cardiac stasis, that machine over there",,1195
4030.651,4033.111,acts as the patient's heart and lungs.,,1196
4033.195,4035.235,It supplies blood throughout the body,,1197
4035.322,4037.742,while doctors are operating on the heart.,,1198
4037.825,4039.405,All right. Let's go over it again.,,1199
4039.994,4043.294,"Stop Chan-hyeong's heart, which is replaced by the machine.",,1200
4043.372,4046.172,"While the machine's working, the doctors quickly fix the heart.",,1201
4046.25,4047.29,"When everything's fixed,",,1202
4047.376,4050.206,they get rid of the tubes that hook him up to the machine.,,1203
4050.296,4052.796,You're telling me all this so that you can remember the steps.,,1204
4052.882,4054.632,You're doing it to memorize the steps.,,1205
4054.717,4055.677,That's right.,,1206
4056.177,4058.427,"-You understand the procedure, right? -Yes, totally.",,1207
4069.857,4070.857,Gwang-hyeon.,3.0,1208
4071.275,4073.525,"The brain-dead TA patient, Yuk Hui-gwan. Where is he?",3.0,1209
4073.611,4076.201,"Oh, they've finished doing all the tests on him in the ICU.",,1210
4076.28,4078.45,The committee will meet soon to finalize the diagnosis.,,1211
4078.532,4081.122,"He's a TA victim, but I heard the organs are in good condition.",,1212
4081.202,4084.792,They're probably negotiating the time frame with the other hospital.,,1213
4086.373,4087.543,Why? Do you know that patient?,,1214
4087.625,4088.995,He was my patient.,3.0,1215
4089.835,4092.125,He was totally fine when he was discharged yesterday.,3.0,1216
4092.213,4094.133,Really? My goodness.,,1217
4094.632,4097.092,It must've been a very difficult decision.,,1218
4098.177,4100.097,You should say a proper goodbye.,,1219
4100.763,4101.813,All right.,3.0,1220
4102.389,4103.769,Have you seen his family?,3.0,1221
4103.849,4105.679,"No, I don't know that much.",,1222
4105.768,4106.978,Okay.,,1223
4107.77,4108.9,Hello.,3.0,1224
4109.396,4110.556,Should I head home now?,3.0,1225
4110.648,4112.018,"No, there's no need.",,1226
4112.108,4114.488,The emergency medicine worked like magic.,,1227
4114.568,4116.488,It's already looking much better.,,1228
4116.57,4118.16,-He's asleep now. -My goodness.,,1229
4118.239,4120.529,"If you come home now, you'll just wake him up.",,1230
4120.616,4122.156,It won't be good.,,1231
4122.326,4126.706,"I called to let you know that he's okay, so don't worry.",,1232
4126.914,4129.584,"But I have to say, how could U-ju's mom",,1233
4129.667,4132.457,not even know about her son's peanut allergy?,,1234
4132.545,4133.495,My goodness.,,1235
4133.587,4135.127,Do you know which restaurant it was?,3.0,1236
4135.214,4136.674,I'll call them.,3.0,1237
4136.757,4139.547,I should find out exactly what he ate.,3.0,1238
4139.802,4141.052,"Okay, hold on.",3.0,1239
4146.35,4147.35,Yes.,3.0,1240
4151.438,4154.228,"-Okay, thank you. -Mom.",3.0,1241
4154.65,4157.4,How come Daddy isn't here yet?,,1242
4159.613,4163.333,Where's Daddy? Where did he go?,,1243
4164.869,4166.909,Mom!,,1244
4169.415,4171.035,Mister!,,1245
4171.584,4174.134,Can you buy me jajangmyeon?,,1246
4174.211,4176.671,"Sure, I'll buy you jajangmyeon.",,1247
4201.488,4203.318,ANESTHESIA DURATION,,1248
4205.117,4206.787,We'll stop the ventilation.,2.0,1249
4206.869,4208.159,Stop the ventilation.,,1250
4209.747,4211.077,Anesthesiologist.,2.0,1251
4211.165,4213.455,Position the patient's head down and hook up the Ambu bag.,2.0,1252
4214.126,4215.166,Is it all over now?,,1253
4215.336,4217.586,They did everything they could in surgery.,,1254
4217.671,4219.801,"Now, the question is whether his heart will beat or not",,1255
4219.882,4222.262,without the machine.,,1256
4222.343,4223.593,"If it does, then it's a success.",,1257
4223.677,4225.507,His heart isn't beating though.,,1258
4225.596,4226.806,Just wait.,,1259
4227.806,4229.726,"Now, the aorta.",2.0,1260
4236.19,4238.48,"Hey, don't look at that.",,1261
4238.567,4241.197,You should be looking at the number on top in green.,,1262
4241.654,4245.204,His heart rate is zero at the moment. That number needs to go up.,,1263
4249.703,4250.873,It's going up.,,1264
4280.484,4282.364,"-Good job, guys. -Thank you.",2.0,1265
4282.444,4283.704,I'll finish up.,,1266
4283.779,4284.949,"Of course, you should.",2.0,1267
4290.035,4291.695,Can these guys get the surgical gowns?,2.0,1268
4300.129,4301.509,"You hear his heartbeat, right?",2.0,1269
4302.256,4303.086,-Yes. -Yes.,,1270
4303.173,4305.093,You should know better as med school students.,2.0,1271
4305.175,4307.215,You're probably hearing your own heartbeat.,2.0,1272
4309.096,4310.846,I see.,,1273
4310.931,4313.851,I'll let you touch it once. Be very careful though.,2.0,1274
4314.685,4317.475,"While touching it, thank Chan-hyeong for staying alive.",2.0,1275
4319.064,4320.074,Okay.,,1276
4329.45,4330.7,What's wrong?,,1277
4333.62,4334.79,It's very strong.,,1278
4336.915,4339.125,"The heartbeat feels very strong, Professor.",,1279
4351.972,4354.272,YEAR 2003,,1280
4367.112,4368.612,Doesn't the heartbeat feel so strong?,,1281
4370.741,4372.081,"It's quite amazing, isn't it?",2.0,1282
4374.87,4376.79,It's the size of a plum.,2.0,1283
4378.582,4381.462,I didn't know it'd feel this strong.,2.0,1284
4382.002,4384.092,This kid's heart stopped beating.,,1285
4384.588,4387.418,"You made it beat again, Professor.",2.0,1286
4391.303,4392.353,Professor.,,1287
4396.475,4398.345,I'll choose Cardiothoracic Surgery.,2.0,1288
4401.021,4404.731,"Professor, I'll choose Cardiothoracic Surgery.",,1289
4404.817,4406.027,"Me, too.",,1290
4407.111,4409.451,I'll apply to Cardiothoracic Surgery as well.,,1291
4412.074,4414.544,"Sure, good choice.",2.0,1292
4414.66,4415.7,"Good work, guys.",2.0,1293
4415.786,4417.366,"Well done, everyone.",2.0,1294
4425.254,4427.634,Make them sign a pledge before they change their mind.,2.0,1295
4431.51,4433.97,Kim Chan-hyeong's guardian.,,1296
4434.054,4436.354,Please come to the operating unit.,,1297
4442.146,4443.976,-Are you Kim Chan-hyeong's guardians? -Yes.,,1298
4444.064,4445.484,-Come in. -Thank you.,,1299
4456.034,4459.464,"Doctor, did Chan-hyeong's surgery go well?",,1300
4467.087,4470.337,Chan-hyeong's surgery went well.,2.0,1301
4471.049,4473.389,We patched up the ventricular hole.,2.0,1302
